페이지,픅징,문형,문형 뜻,예문,예문 뜻,예문 요미가나
JLPT_N3_암기장::69p,[여러 품사 뒤에 접속하는 문형],～うちに,"~하는 동안에, ~일 때",英語を学ぶうちに留学に興味を持つようになった。,영어를 배우는 동안에 유학에 흥미를 가지게 되었다。,英語[えいご]を学[まな]ぶうちに留学[りゅうがく]に興味[きょうみ]を持[も]つようになった。
JLPT_N3_암기장::69p,[여러 품사 뒤에 접속하는 문형],～うちに,"~하는 동안에, ~일 때",祖父が元気なうちにたくさん会いに行くつもりだ。,할아버지가 건강하신 동안에 많이 만나러 갈 생각이다。,祖父[そふ]が元気[げんき]なうちにたくさん会[あ]いに行[い]くつもりだ。
JLPT_N3_암기장::69p,[여러 품사 뒤에 접속하는 문형],～うちに,"~하는 동안에, ~일 때",料理は熱いうちに食べたほうがおいしいです。,요리는 뜨거울 때 먹는 편이 맛있습니다。,料理[りょうり]は熱[あつ]いうちに食[た]べたほうがおいしいです。
JLPT_N3_암기장::69p,[여러 품사 뒤에 접속하는 문형],～うちに,"~하는 동안에, ~일 때",学生のうちに一人で旅行してみたいです。,학생일 때 혼자서 여행해 보고 싶습니다。,学生[がくせい]のうちに一人[ひとり]で旅行[りょこう]してみたいです。
JLPT_N3_암기장::69p,[여러 품사 뒤에 접속하는 문형],～うちに,"~하는 동안에, ~일 때",忘れないうちに、みんなに連絡しておきましょう。,"잊어버리기 전에, 모두에게 연락해 둡시다。",忘[わす]れないうちに、みんなに連絡[れんらく]しておきましょう。
JLPT_N3_암기장::70p,[여러 품사 뒤에 접속하는 문형],～にしても,"~라고 해도, ~인 경우에도",遊ぶにしても宿題を済ませないと遊びに行けません。,놀러 간다고 해도 숙제를 끝내지 않으면 놀러 갈 수 없습니다。,遊[あそ]ぶにしても宿題[しゅくだい]を済[す]ませないと遊[あそ]びに行[い]けません。
JLPT_N3_암기장::70p,[여러 품사 뒤에 접속하는 문형],～にしても,"~라고 해도, ~인 경우에도",数学が苦手であるにしてもこれくらいの問題は解けます。,수학을 잘 못한다고 해도 이 정도의 문제는 풀 수 있습니다。,数学[すうがく]が苦手[にがて]であるにしてもこれくらいの問題[もんだい]は解[と]けます。
JLPT_N3_암기장::70p,[여러 품사 뒤에 접속하는 문형],～にしても,"~라고 해도, ~인 경우에도",安いにしても、今はお金がなくて買えません。,"싸다고 해도, 지금은 돈이 없어서 살 수 없습니다。",安[やす]いにしても、今[いま]はお金[かね]がなくて買[か]えません。
JLPT_N3_암기장::70p,[여러 품사 뒤에 접속하는 문형],～にしても,"~라고 해도, ~인 경우에도",休日にしても今日のデパートは人が多すぎるんじゃないかな。,휴일이라고 해도 오늘 백화점은 사람이 너무 많은 것 같아요。,休日[きゅうじつ]にしても今日[きょう]のデパート[でぱーと]は人[ひと]が多[おお]すぎるんじゃないかな。
JLPT_N3_암기장::70p,[여러 품사 뒤에 접속하는 문형],～にしては,~치고는,練習したにしては結果があまりよくなかった。,연습한 것치고는 결과가 별로 좋지 않았다。,練習[れんしゅう]したにしては結果[けっか]があまりよくなかった。
JLPT_N3_암기장::70p,[여러 품사 뒤에 접속하는 문형],～にしては,~치고는,彼ははじめにしては遅刻が多い。,그는 처음인데 치고는 지각이 많다。,彼[かれ]ははじめにしては遅刻[ちこく]が多[おお]い。
JLPT_N3_암기장::70p,[여러 품사 뒤에 접속하는 문형],～にしては,~치고는,このコップは小さいにしては重い。,이 컵은 작지만 치고는 무겁다。,このコップ[こっぷ]は小[ちい]さいにしては重[おも]い。
JLPT_N3_암기장::70p,[여러 품사 뒤에 접속하는 문형],～にしては,~치고는,人生初めての面接にしては、全く緊張しなかった。,인생 첫 면접 치고는 전혀 긴장하지 않았다。,人生[じんせい]初[はじ]めての面接[めんせつ]にしては、全[まった]く緊張[きんちょう]しなかった。
JLPT_N3_암기장::70p,[여러 품사 뒤에 접속하는 문형],～につれ,~(함)에 따라,発表する日が近づくにつれ緊張してきました。,발표하는 날이 가까워질수록 긴장되었습니다。,発表[はっぴょう]する日[ひ]が近[ちか]づくにつれ緊張[きんちょう]してきました。
JLPT_N3_암기장::70p,[여러 품사 뒤에 접속하는 문형],～につれ,~(함)에 따라,時代の変化につれ、人も言葉も変わっていく。,시대 변화에 따라 사람도 말도 변해 간다。,時代[じだい]の変化[へんか]につれ、人[ひと]も言葉[ことば]も変[か]わっていく。
JLPT_N3_암기장::70p,[여러 품사 뒤에 접속하는 문형],～場合,~인 경우,電話番号が変わった場合は新しい番号を教えてくださいね。,전화번호가 바뀐 경우에는 새로운 번호를 알려 주세요。,電話番号[でんわばんごう]が変[か]わった場合[ばあい]は新[あたら]しい番号[ばんごう]を教[おし]えてくださいね。
JLPT_N3_암기장::70p,[여러 품사 뒤에 접속하는 문형],～場合,~인 경우,受験のことで不安な場合はいつでも相談にきていいですよ。,입시에 대해 불안한 경우에는 언제든 상담하러 와도 됩니다。,受験[じゅけん]のことで不安[ふあん]な場合[ばあい]はいつでも相談[そうだん]にきていいですよ。
JLPT_N3_암기장::70p,[여러 품사 뒤에 접속하는 문형],～場合,~인 경우,何度注意しても守らない場合は、警察に連絡します。,아무리 주의를 줘도 지키지 않는 경우에는 경찰에 연락합니다。,何度[なんど]注意[ちゅうい]しても守[まも]らない場合[ばあい]は、警察[けいさつ]に連絡[れんらく]します。
JLPT_N3_암기장::70p,[여러 품사 뒤에 접속하는 문형],～場合,~인 경우,火事、地震など、非常の場合には、階段を利用してください。,"화재, 지진 등 비상 상황의 경우에는 계단을 이용해 주세요。",火事[かじ]、地震[じしん]など、非常[ひじょう]の場合[ばあい]には、階段[かいだん]を利用[りよう]してください。
JLPT_N3_암기장::71p,[여러 품사 뒤에 접속하는 문형],～ほか,~외에,風邪予防には人の多い場所を避けるほかに、手を洗うのが大切だ。,"감기 예방을 위해 사람이 많은 장소를 피하는 것 외에, 손을 씻는 것이 중요하다。",風邪予防[かぜよぼう]には人[ひと]の多[おお]い場所[ばしょ]を避[さ]けるほかに、手[て]を洗[あら]うのが大切[たいせつ]だ。
JLPT_N3_암기장::71p,[여러 품사 뒤에 접속하는 문형],～ほか,~외에,日本は家では靴を脱ぐのが一般的だが、床に座るのも一般的だ。,"일본에서는 집에서 신발을 벗는 것이 일반적이지만, 바닥에 앉는 것도 일반적이다。",日本[にほん]は家[いえ]では靴[くつ]を脱[ぬ]ぐのが一般的[いっぱんてき]だが、床[ゆか]に座[すわ]るのも一般的[いっぱんてき]だ。
JLPT_N3_암기장::71p,[여러 품사 뒤에 접속하는 문형],～ほか,~외에,ここは駅から近いほかにメリットがない。,여기는 역에서 가까운 것 외에 장점이 없다。,ここは駅[えき]から近[ちか]いほかにメリット[めりっと]がない。
JLPT_N3_암기장::71p,[여러 품사 뒤에 접속하는 문형],～ほか,~외에,急激に上昇した物価のほか、税金も上がって生活は苦しくなった。,급격히 상승한 물가 외에도 세금도 올라서 생활이 어려워졌다。,急激[きゅうげき]に上昇[じょうしょう]した物価[ぶっか]のほか、税金[ぜいきん]も上[あ]がって生活[せいかつ]は苦[くる]しくなった。
JLPT_N3_암기장::71p,[여러 품사 뒤에 접속하는 문형],～前に,~전에,食事をする前に手を洗いましょう。,식사하기 전에 손을 씻읍시다。,食事[しょくじ]をする前[まえ]に手[て]を洗[あら]いましょう。
JLPT_N3_암기장::71p,[여러 품사 뒤에 접속하는 문형],～前に,~전에,面接の準備の前にまずは筆記試験に合格することが大切です。,면접 준비를 하기 전에 우선 필기 시험에 합격하는 것이 중요하다。,面接[めんせつ]の準備[じゅんび]の前[まえ]にまずは筆記試験[ひっきしけん]に合格[ごうかく]することが大切[たいせつ]です。
JLPT_N3_암기장::71p,[여러 품사 뒤에 접속하는 문형],～まま,"~한 채, ~대로",テレビをつけたまま、寝てしまった。,텔레비전을 켠 채로 잠들어 버렸다。,テレビ[てれび]をつけたまま、寝[ね]てしまった。
JLPT_N3_암기장::71p,[여러 품사 뒤에 접속하는 문형],～まま,"~한 채, ~대로",出かけた息子が帰って来なくて心配なまま一日を過ごした。,외출한 아들이 돌아오지 않아서 걱정된 채로 하루를 보냈다。,出[で]かけた息子[むすこ]が帰[かえ]って来[こ]なくて心配[しんぱい]なまま一日[いちにち]を過[す]ごした。
JLPT_N3_암기장::71p,[여러 품사 뒤에 접속하는 문형],～まま,"~한 채, ~대로",何度洗濯してもその靴下は臭いままだった。,아무리 세탁해도 그 양말은 여전히 냄새가 났다。,何度[なんど]洗濯[せんたく]してもその靴下[くつした]は臭[くさ]いままだった。
JLPT_N3_암기장::71p,[여러 품사 뒤에 접속하는 문형],～まま,"~한 채, ~대로",彼女は外国人と結婚したが、国籍は日本のままです。,그녀는 외국인과 결혼했지만 국적은 여전히 일본이다。,彼女[かのじょ]は外国人[がいこくじん]と結婚[けっこん]したが、国籍[こくせき]は日本[にほん]のままです。
JLPT_N3_암기장::71p,[여러 품사 뒤에 접속하는 문형],～わりに,~에 비해서,いつもお金がないって言ってるわりに、よく旅行に行くね。,항상 돈이 없다고 말하는 것에 비해서 자주 여행을 가네。,いつもお金[かね]がないって言[い]ってるわりに、よく旅行[りょこう]に行[い]くね。
JLPT_N3_암기장::71p,[여러 품사 뒤에 접속하는 문형],～わりに,~에 비해서,あの山道は坂が急なわりに意外と歩きやすいです。,저 산길은 경사가 가파른 것에 비해서 의외로 걷기 쉽습니다。,あの山道[さんどう]は坂[さか]が急[きゅう]なわりに意外[いがい]と歩[ある]きやすいです。
JLPT_N3_암기장::71p,[여러 품사 뒤에 접속하는 문형],～わりに,~에 비해서,友達は頭がいいわりに成績はよくないらしい。,친구는 머리가 좋은 것에 비해서 성적은 좋지 않은 것 같다。,友達[ともだち]は頭[あたま]がいいわりに成績[せいせき]はよくないらしい。
JLPT_N3_암기장::71p,[여러 품사 뒤에 접속하는 문형],～わりに,~에 비해서,あの二人は姉妹のわりに顔も性格も似ていない。,저 두 사람은 자매인 것에 비해서 얼굴도 성격도 닮지 않았다。,あの二人[ふたり]は姉妹[しまい]のわりに顔[かお]も性格[せいかく]も似[に]ていない。
JLPT_N3_암기장::72p,[여러 품사 뒤에 접속하는 문형],～おかげだ,~덕분이다,外国人の友達がたくさんいるのは、海外で暮らしていたおかげだ。,외국인 친구가 많은 것은 해외에서 생활했던 덕분이다。,外国人[がいこくじん]の友達[ともだち]がたくさんいるのは、海外[かいがい]で暮[く]らしていたおかげだ。
JLPT_N3_암기장::72p,[여러 품사 뒤에 접속하는 문형],～おかげだ,~덕분이다,いろいろな場所に旅行に行けるのは、運転ができるおかげだ。,여러 장소에 여행을 갈 수 있는 것은 운전이 가능한 덕분이다。,いろいろな場所[ばしょ]に旅行[りょこう]に行[い]けるのは、運転[うんてん]ができるおかげだ。
JLPT_N3_암기장::72p,[여러 품사 뒤에 접속하는 문형],～おかげだ,~덕분이다,今日、かばんが軽いのは、いつもより授業が少ないおかげだ。,오늘 가방이 가벼운 것은 평소보다 수업이 적은 덕분이다。,今日[きょう]、かばんが軽[かる]いのは、いつもより授業[じゅぎょう]が少[すく]ないおかげだ。
JLPT_N3_암기장::72p,[여러 품사 뒤에 접속하는 문형],～おかげだ,~덕분이다,子供が無事だったのはあなたのおかげです。,아이가 무사한 것은 당신 덕분입니다。,子供[こども]が無事[ぶじ]だったのはあなたのおかげです。
JLPT_N3_암기장::72p,[여러 품사 뒤에 접속하는 문형],～かもしれない,~일지도 모른다,犯人は事件現場にまた現れるかもしれない。,범인은 사건 현장에 다시 나타날지도 모른다。,犯人[はんにん]は事件[じけん]現場[げんば]にまた現[あら]れるかもしれない。
JLPT_N3_암기장::72p,[여러 품사 뒤에 접속하는 문형],～かもしれない,~일지도 모른다,彼は料理が下手かもしれない。,그는 요리가 서툴지도 모른다。,彼[かれ]は料理[りょうり]が下手[へた]かもしれない。
JLPT_N3_암기장::72p,[여러 품사 뒤에 접속하는 문형],～かもしれない,~일지도 모른다,思ったより面白いかもしれない。,생각보다 재미있을지도 몰라。,思[おも]ったより面白[おもしろ]いかもしれない。
JLPT_N3_암기장::72p,[여러 품사 뒤에 접속하는 문형],～かもしれない,~일지도 모른다,あの人はいろいろな病気について詳しいから医者かもしれない。,저 사람은 다양한 병에 대해 잘 알고 있기 때문에 의사일지도 모른다。,あの人[ひと]はいろいろな病気[びょうき]について詳[くわ]しいから医者[いしゃ]かもしれない。
JLPT_N3_암기장::72p,[여러 품사 뒤에 접속하는 문형],～かどうか,~인지 어떤지,この仕事を新人に任せるかどうか、もう一度考えないといけない。,이 일을 신입사원에게 맡길지 어떨지 다시 생각해야 한다。,この仕事[しごと]を新人[しんじん]に任[まか]せるかどうか、もう一度[いちど]考[かんが]えないといけない。
JLPT_N3_암기장::72p,[여러 품사 뒤에 접속하는 문형],～かどうか,~인지 어떤지,あの子がいたずらっ子かどうかなんて友達の僕が一番よく知っている。,저 아이가 짓궂은지 어떤지 따위 친구인 내가 가장 잘 알고 있습니다。,あの子[こ]がいたずらっ子[こ]かどうかなんて友達[ともだち]の僕[ぼく]が一番[いちばん]よく知[し]っている。
JLPT_N3_암기장::72p,[여러 품사 뒤에 접속하는 문형],～かどうか,~인지 어떤지,その映画が面白いかどうかは見てみないと分からない。,그 영화가 재미있는지 어떤지는 봐 보지 않으면 모른다。,その映画[えいが]が面白[おもしろ]いかどうかは見[み]てみないと分[わ]からない。
JLPT_N3_암기장::72p,[여러 품사 뒤에 접속하는 문형],～かどうか,~인지 어떤지,来週の遠足が中止になるかどうかは当日の天気で決まります。,다음 주 소풍이 중지될지 어떨지는 당일의 날씨로 결정됩니다。,来週[らいしゅう]の遠足[えんそく]が中止[ちゅうし]になるかどうかは当日[とうじつ]の天気[てんき]で決[き]まります。
JLPT_N3_암기장::73p,[여러 품사 뒤에 접속하는 문형],～がる,"~하고 싶어하다, ~해 하다",祖父は孫に会いたがっている。,할아버지는 손자를 보고 싶어 하고 있다。,祖父[そふ]は孫[まご]に会[あ]いたがっている。
JLPT_N3_암기장::73p,[여러 품사 뒤에 접속하는 문형],～がる,"~하고 싶어하다, ~해 하다",子供が犬を不安がるので、大きな音で驚かないでくれませんか。,"아이가 개를 불안해하기 때문에, 큰 소리로 놀라지 말아 주시겠습니까?",子供[こども]が犬[いぬ]を不安[ふあん]がるので、大[おお]きな音[おと]で驚[おどろ]かないでくれませんか。
JLPT_N3_암기장::73p,[여러 품사 뒤에 접속하는 문형],～がる,"~하고 싶어하다, ~해 하다",妹は犬を怖がる。,여동생은 개를 무서워한다。,妹[いもうと]は犬[いぬ]を怖[こわ]がる。
JLPT_N3_암기장::73p,[여러 품사 뒤에 접속하는 문형],～すぎる,너무 ~하다,チョコレートは冷やしすぎると固くなりすぎる。,초콜릿을 너무 식히면 너무 딱딱해진다。,チョコレート[ちょこれーと]は冷[ひ]やしすぎると固[かた]くなりすぎる。
JLPT_N3_암기장::73p,[여러 품사 뒤에 접속하는 문형],～すぎる,너무 ~하다,彼女はいつも上品すぎて、ただの一般人とは思えない。,"그녀는 항상 너무 고상해서, 그저 일반인이라고는 생각할 수 없다。",彼女[かのじょ]はいつも上品[じょうひん]すぎて、ただの一般人[いっぱんじん]とは思[おも]えない。
JLPT_N3_암기장::73p,[여러 품사 뒤에 접속하는 문형],～すぎる,너무 ~하다,このコーヒーは熱すぎる。,이 커피는 너무 뜨겁다。,このコーヒー[こーひー]は熱[あつ]すぎる。
JLPT_N3_암기장::73p,[여러 품사 뒤에 접속하는 문형],～すぎる,너무 ~하다,もらったお米が大量すぎて一人では食べられません。,받은 쌀이 너무 많아서 혼자서는 먹을 수 없습니다。,もらったお米[こめ]が大量[たいりょう]すぎて一人[ひとり]では食[た]べられません。
JLPT_N3_암기장::73p,[여러 품사 뒤에 접속하는 문형],～だろう,"~일 것이다, ~겠지",来週には桜が咲くだろう。,다음 주에는 벚꽃이 피겠지。,来週[らいしゅう]には桜[さくら]が咲[さ]くだろう。
JLPT_N3_암기장::73p,[여러 품사 뒤에 접속하는 문형],～だろう,"~일 것이다, ~겠지",この試合に負けても優勝できるので気楽だろう。,이 경기에서 져도 우승할 수 있어서 마음이 편하겠지。,この試合[しあい]に負[ま]けても優勝[ゆうしょう]できるので気楽[きらく]だろう。
JLPT_N3_암기장::73p,[여러 품사 뒤에 접속하는 문형],～だろう,"~일 것이다, ~겠지",熱が下がったばかりでまだ体がだるいだろう。,열이 내린 직후라서 아직 몸이 나른하겠지。,熱[ねつ]が下[さ]がったばかりでまだ体[からだ]がだるいだろう。
JLPT_N3_암기장::73p,[여러 품사 뒤에 접속하는 문형],～だろう,"~일 것이다, ~겠지",留学して1年、そろそろ帰国するさだろう。,"유학한 지 1년, 슬슬 귀국할 때겠지。",留学[りゅうがく]して1年[いちねん]、そろそろ帰国[きこく]するさだろう。
JLPT_N3_암기장::74p,[여러 품사 뒤에 접속하는 문형],～に決まっている,"당연히 ~이다, ~으로 정해져 있다",遅刻したら、先生は怒るに決まっている。,"지각했다면, 선생님은 화를 내는 것이 당연하다。",遅刻[ちこく]したら、先生[せんせい]は怒[おこ]るに決[き]まっている。
JLPT_N3_암기장::74p,[여러 품사 뒤에 접속하는 문형],～に決まっている,"당연히 ~이다, ~으로 정해져 있다",彼女が作った料理だから、おいしいに決まっている。,"그녀가 만든 요리니까, 맛있는 것이 당연하다。",彼女[かのじょ]が作[つく]った料理[りょうり]だから、おいしいに決[き]まっている。
JLPT_N3_암기장::74p,[여러 품사 뒤에 접속하는 문형],～に決まっている,"당연히 ~이다, ~으로 정해져 있다",今年の優勝は彼に決まっている。,올해의 우승은 그로 정해져 있다。,今年[ことし]の優勝[ゆうしょう]は彼[かれ]に決[き]まっている。
JLPT_N3_암기장::74p,[여러 품사 뒤에 접속하는 문형],～に違いない,~임에 틀림없다,あの俳優は今年きっと売れるに違いない。,저 배우는 올해 반드시 인기를 끌 것이 틀림없다。,あの俳優[はいゆう]は今年[ことし]きっと売[う]れるに違[ちが]いない。
JLPT_N3_암기장::74p,[여러 품사 뒤에 접속하는 문형],～に違いない,~임에 틀림없다,私が想像するよりも子供を育てることは大変に違いない。,내가 상상하는 것보다 아이를 키우는 것은 힘든 일이 틀림없다。,私[わたし]が想像[そうぞう]するよりも子供[こども]を育[そだ]てることは大変[たいへん]に違[ちが]いない。
JLPT_N3_암기장::74p,[여러 품사 뒤에 접속하는 문형],～に違いない,~임에 틀림없다,今回の試験は難しかったに違いない。,이번 시험은 어려웠음에 틀림없다。,今回[こんかい]の試験[しけん]は難[むずか]しかったに違[ちが]いない。
JLPT_N3_암기장::74p,[여러 품사 뒤에 접속하는 문형],～に違いない,~임에 틀림없다,まさか私が代表だなんて。きっと冗談に違いない。,설마 내가 대표라니. 틀림없이 농담이다。,まさか私[わたし]が代表[だいひょう]だなんて。きっと冗談[じょうだん]に違[ちが]いない。
JLPT_N3_암기장::74p,[여러 품사 뒤에 접속하는 문형],～に行く,~하러 가다,コンビニにパンを買いに行った。,편의점에 빵을 사러 갔다。,コンビニ[こんびに]にパン[ぱん]を買[か]いに行[い]った。
JLPT_N3_암기장::74p,[여러 품사 뒤에 접속하는 문형],～に行く,~하러 가다,週末は家族みんなで外食に行くことになっている。,주말에는 가족 모두 외식하러 가기로 되어 있다。,週末[しゅうまつ]は家族[かぞく]みんなで外食[がいしょく]に行[い]くことになっている。
JLPT_N3_암기장::74p,[여러 품사 뒤에 접속하는 문형],～にしたがって,~에 따라,高度が上昇するにしたがって気圧は下がる。,고도가 상승함에 따라 기압이 내려간다。,高度[こうど]が上昇[じょうしょう]するにしたがって気圧[きあつ]は下[さ]がる。
JLPT_N3_암기장::74p,[여러 품사 뒤에 접속하는 문형],～にしたがって,~에 따라,先生の合図にしたがって生徒たちは同時に歩き出した。,선생님의 신호에 따라 학생들이 동시에 걷기 시작했다。,先生[せんせい]の合図[あいず]にしたがって生徒[せいと]たちは同時[どうじ]に歩[ある]き出[だ]した。
JLPT_N3_암기장::75p,[여러 품사 뒤에 접속하는 문형],～のです（～んです）,"~인 것입니다, ~입니다",来週、試合なのにちっとも練習に来ないで何をやっていたのですか。,다음 주에 시합인데 전혀 연습에 오지 않고 무엇을 하고 있었던 겁니까?,来週[らいしゅう]、試合[しあい]なのにちっとも練習[れんしゅう]に来[こ]ないで何[なに]をやっていたのですか。
JLPT_N3_암기장::75p,[여러 품사 뒤에 접속하는 문형],～のです（～んです）,"~인 것입니다, ~입니다",この店はお昼だけ飲み物のおかわりが無料なんですよ。,이 가게는 점심시간만 음료 리필이 무료입니다。,この店[みせ]はお昼[ひる]だけ飲[の]み物[もの]のおかわりが無料[むりょう]なんですよ。
JLPT_N3_암기장::75p,[여러 품사 뒤에 접속하는 문형],～のです（～んです）,"~인 것입니다, ~입니다",昨日からご飯も食べなくてなんか様子がおかしいのです。,어제부터 밥도 먹지 않고 뭔가 상태가 이상합니다。,昨日[きのう]からご飯[ごはん]も食[た]べなくてなんか様子[ようす]がおかしいのです。
JLPT_N3_암기장::75p,[여러 품사 뒤에 접속하는 문형],～のです（～んです）,"~인 것입니다, ~입니다",女子サッカー選手になることが昔から私の夢なんです。,여자 축구선수가 되는 것이 예전부터 저의 꿈입니다。,女子[じょし]サッカー[さっかー]選手[せんしゅ]になることが昔[むかし]から私[わたし]の夢[ゆめ]なんです。
JLPT_N3_암기장::75p,[여러 품사 뒤에 접속하는 문형],～はずだ,~일 것이다,この地域は地震がよく起きるので普段から備えているはずです。,이 지역은 지진이 자주 발생하므로 평소부터 대비하고 있을 것입니다。,この地域[ちいき]は地震[じしん]がよく起[お]きるので普段[ふだん]から備[そな]えているはずです。
