페이지,픅징,문형,문형 뜻,예문,예문 뜻,예문 요미가나
JLPT_N3_암기장::63p,[여러 품사 뒤에 접속하는 문형],～と,~하면,砂糖を入れると甘くなります。,설탕을 넣으면 달아집니다。,砂糖[さとう]を入[い]れると甘[あま]くなります。
JLPT_N3_암기장::63p,[여러 품사 뒤에 접속하는 문형],～ないと,~하지 않으면,何でも積極的ではないとせっかくの機会を失ってしまう。,무엇이든 적극적이지 않으면 모처럼의 기회를 잃어버린다。,何[なん]でも積極的[せっきょくてき]ではないとせっかくの機会[きかい]を失[うしな]ってしまう。
JLPT_N3_암기장::63p,[여러 품사 뒤에 접속하는 문형],～ないと,~하지 않으면,動きがあまり激しいと疲れやすいので、腕は小さく動かします。,"움직임이 지나치게 격하면 피로해지기 쉬우므로, 팔은 작게 움직입니다。",動[うご]きがあまり激[はげ]しいと疲[つか]れやすいので、腕[うで]は小[ちい]さく動[うご]かします。
JLPT_N3_암기장::63p,[여러 품사 뒤에 접속하는 문형],～ないと,~하지 않으면,今日は大雨だから休業が休講じゃないと納得できない。,오늘은 큰비이므로 수업이 휴강이 아니면 납득할 수 없다。,今日[きょう]は大雨[おおあめ]だから休業[きゅうぎょう]が休講[きゅうこう]じゃないと納得[なっとく]できない。
JLPT_N3_암기장::64p,[여러 품사 뒤에 접속하는 문형],～という,"~라는, ~라고 하는",林さんがやめるといううわさを聞きました。,하야시 씨가 그만둔다고 하는 소문을 들었습니다。,林[はやし]さんがやめるといううわさを聞[き]きました。
JLPT_N3_암기장::64p,[여러 품사 뒤에 접속하는 문형],～という,"~라는, ~라고 하는",今年の山下公園の桜は見事だということです。,올해 야마시타 공원의 벚꽃은 훌륭하다고 합니다。,今年[ことし]の山下公園[やましたこうえん]の桜[さくら]は見事[みごと]だということです。
JLPT_N3_암기장::64p,[여러 품사 뒤에 접속하는 문형],～という,"~라는, ~라고 하는",お風呂の水を捨てるのはもったいないという人もいます。,욕조의 물을 버리는 것은 아깝다고 하는 사람도 있습니다。,お風呂[おふろ]の水[みず]を捨[す]てるのはもったいないという人[ひと]もいます。
JLPT_N3_암기장::64p,[여러 품사 뒤에 접속하는 문형],～という,"~라는, ~라고 하는",奨学金という援助を受けながら、大学に通っています。,"장학금이라고 하는 원조를 받으면서, 대학을 다니고 있습니다。",奨学金[しょうがくきん]という援助[えんじょ]を受[う]けながら、大学[だいがく]に通[かよ]っています。
JLPT_N3_암기장::64p,[여러 품사 뒤에 접속하는 문형],～ということだ,~라고 한다,この店はしばらく休業するということだ。,이 가게는 잠시 휴업한다고 한다。,この店[みせ]はしばらく休業[きゅうぎょう]するということだ。
JLPT_N3_암기장::64p,[여러 품사 뒤에 접속하는 문형],～ということだ,~라고 한다,駅前にあるあの広告は効果的だということだ。,역 앞에 있는 저 광고는 효과적이라고 한다。,駅前[えきまえ]にあるあの広告[こうこく]は効果的[こうかてき]だということだ。
JLPT_N3_암기장::64p,[여러 품사 뒤에 접속하는 문형],～ということだ,~라고 한다,彼はテレビも買えないくらいに貧しいということだ。,그는 텔레비전도 살 수 없을 정도로 가난하다고 한다。,彼[かれ]はテレビ[てれび]も買[か]えないくらいに貧[まず]しいということだ。
JLPT_N3_암기장::64p,[여러 품사 뒤에 접속하는 문형],～ということだ,~라고 한다,あの会社の経営は、今危ない状態だということだ。,"저 회사의 경영은, 지금 위험한 상태라고 한다。",あの会社[かいしゃ]の経営[けいえい]は、今[いま]危[あぶ]ない状態[じょうたい]だということだ。
JLPT_N3_암기장::64p,[여러 품사 뒤에 접속하는 문형],～というのに,~라고 하는데,来月友だちが結婚するというのに、なぜか少し悲しくなった。,"다음 달 친구가 결혼한다고 하는데, 왠지 조금 슬퍼졌다。",来月[らいげつ]友[とも]だちが結婚[けっこん]するというのに、なぜか少[すこ]し悲[かな]しくなった。
JLPT_N3_암기장::64p,[여러 품사 뒤에 접속하는 문형],～というのに,~라고 하는데,レストランの予約がいっぱいだというのに、どうしても行きたい。,"레스토랑 예약이 꽉 찼다고 하는데, 어떻게든 가고 싶다。",レストラン[れすとらん]の予約[よやく]がいっぱいだというのに、どうしても行[い]きたい。
JLPT_N3_암기장::64p,[여러 품사 뒤에 접속하는 문형],～というのに,~라고 하는데,みんなあの曲はとてもいいというのに、私はあまり好きではない。,"모두 저 노래는 매우 좋다고 하는데, 나는 그다지 좋아하지 않는다。",みんなあの曲[きょく]はとてもいいというのに、私[わたし]はあまり好[す]きではない。
JLPT_N3_암기장::64p,[여러 품사 뒤에 접속하는 문형],～というのに,~라고 하는데,彼は先生だというのに、まったくそう見えない。,"그는 선생님이라고 하는데, 전혀 그렇게 보이지 않는다。",彼[かれ]は先生[せんせい]だというのに、まったくそう見[み]えない。
JLPT_N3_암기장::65p,[여러 품사 뒤에 접속하는 문형],～というような,~와 같은,リムジンに乗るというようなすごい経験をしました。,리무진을 타는 것과 같은 대단한 경험을 했습니다。,リムジン[りむじん]に乗[の]るというようなすごい経験[けいけん]をしました。
JLPT_N3_암기장::65p,[여러 품사 뒤에 접속하는 문형],～というような,~와 같은,周りを気の毒だというような態度をとられても気にしません。,주변에서 가엾다는 듯한 태도를 보여도 신경 쓰지 않습니다。,周[まわ]りを気[き]の毒[どく]だというような態度[たいど]をとられても気[き]にしません。
JLPT_N3_암기장::65p,[여러 품사 뒤에 접속하는 문형],～というような,~와 같은,申し訳ないというような表情をされると、すぐに許してしまう。,"미안하다는 듯한 표정을 지으면, 바로 용서해 버린다。",申し訳[もうしわけ]ないというような表情[ひょうじょう]をされると、すぐに許[ゆる]してしまう。
JLPT_N3_암기장::65p,[여러 품사 뒤에 접속하는 문형],～というような,~와 같은,世の中に絶対というようなものはありません。,세상에 절대적인 것과 같은 것은 없습니다。,世の中[よのなか]に絶対[ぜったい]というようなものはありません。
JLPT_N3_암기장::65p,[여러 품사 뒤에 접속하는 문형],～といっても,~라고 해도,中国語ができるといっても、あいさつぐらいです。,"중국어를 할 수 있다고 해도, 인사 정도입니다。",中国語[ちゅうごくご]ができるといっても、あいさつぐらいです。
JLPT_N3_암기장::65p,[여러 품사 뒤에 접속하는 문형],～といっても,~라고 해도,兄は元気だといっても骨折していることにかわりない。,형이 건강하다고 해도 골절된 것은 변함없다。,兄[あに]は元気[げんき]だといっても骨折[こっせつ]していることにかわりない。
JLPT_N3_암기장::65p,[여러 품사 뒤에 접속하는 문형],～といっても,~라고 해도,水泳がうまいといっても、もっと上手な人はたくさんいます。,"수영을 잘한다고 해도, 더 잘하는 사람이 많습니다。",水泳[すいえい]がうまいといっても、もっと上手[じょうず]な人[ひと]はたくさんいます。
JLPT_N3_암기장::65p,[여러 품사 뒤에 접속하는 문형],～といっても,~라고 해도,いくらそれが最近の流行だといっても、決してまねはしたくない。,"아무리 그것이 최근 유행이라고 해도, 절대 따라 하고 싶지 않다。",いくらそれが最近[さいきん]の流行[りゅうこう]だといっても、決[けっ]してまねはしたくない。
JLPT_N3_암기장::65p,[여러 품사 뒤에 접속하는 문형],～としたら,~라고 하면,もし自分を色で表すとしたら、何色だと思う？,"만약 자신을 색으로 나타낸다고 하면, 어떤 색이라고 생각해?",もし自分[じぶん]を色[いろ]で表[あらわ]すとしたら、何色[なにいろ]だと思[おも]う？
JLPT_N3_암기장::65p,[여러 품사 뒤에 접속하는 문형],～としたら,~라고 하면,顔が真っ青だとしたら、すぐに家に帰って休む必要がある。,"얼굴이 창백하다면, 바로 집에 가서 쉬는 것이 필요하다。",顔[かお]が真[ま]っ青[あお]だとしたら、すぐに家[いえ]に帰[かえ]って休[やす]む必要[ひつよう]がある。
JLPT_N3_암기장::65p,[여러 품사 뒤에 접속하는 문형],～としたら,~라고 하면,犬がおとなしいとしたら、お店に連れて行ってもいいですか？,"강아지가 얌전하다면, 가게에 데리고 가도 괜찮습니까?",犬[いぬ]がおとなしいとしたら、お店[みせ]に連[つ]れて行[い]ってもいいですか？
JLPT_N3_암기장::65p,[여러 품사 뒤에 접속하는 문형],～としたら,~라고 하면,その話が誤解だとしたら、はやく本当のことを伝えるべきです。,"그 이야기가 오해라면, 빨리 진실을 전달해야 합니다。",その話[はなし]が誤解[ごかい]だとしたら、はやく本当[ほんとう]のことを伝[つた]えるべきです。
JLPT_N3_암기장::66p,[여러 품사 뒤에 접속하는 문형],～としても,~라고 해도,部屋を片付けたとしても、また散らかしてしまうと思います。,"방을 정리했다고 해도, 또 어질러 놓을 거라고 생각합니다。",部屋[へや]を片付[かたづ]けたとしても、また散[ちら]かしてしまうと思[おも]います。
JLPT_N3_암기장::66p,[여러 품사 뒤에 접속하는 문형],～としても,~라고 해도,たとえ困難だとしても最初から諦めてはいけません。,만약 곤란하다고 해도 처음부터 포기해서는 안 됩니다。,たとえ困難[こんなん]だとしても最初[さいしょ]から諦[あきら]めてはいけません。
JLPT_N3_암기장::66p,[여러 품사 뒤에 접속하는 문형],～としても,~라고 해도,怪しかったとしても理由もなく人を疑うことはよくない。,수상했다고 해도 이유 없이 사람을 의심하는 것은 좋지 않다。,怪[あや]しかったとしても理由[りゆう]もなく人[ひと]を疑[うたが]うことはよくない。
JLPT_N3_암기장::66p,[여러 품사 뒤에 접속하는 문형],～としても,~라고 해도,もし事実だとしても信じたくない。,만약 사실이라고 해도 믿고 싶지 않다。,もし事実[じじつ]だとしても信[しん]じたくない。
JLPT_N3_암기장::66p,[여러 품사 뒤에 접속하는 문형],～とは限らない,~라고 할 수는 없다,必ずしも勝つとは限りません。,반드시 이긴다고 단정지을 수 없습니다。,必[かなら]ずしも勝[か]つとは限[かぎ]りません。
JLPT_N3_암기장::66p,[여러 품사 뒤에 접속하는 문형],～とは限らない,~라고 할 수는 없다,いつも笑っているからといってその人が幸せだとは限らない。,항상 웃고 있다고 해서 그 사람이 행복하다고 단정지을 수 없다。,いつも笑[わら]っているからといってその人[ひと]が幸[しあわ]せだとは限[かぎ]らない。
JLPT_N3_암기장::66p,[여러 품사 뒤에 접속하는 문형],～とは限らない,~라고 할 수는 없다,小学校から同じクラスだからといって親しいとは限りません。,초등학교부터 같은 반이었다고 해도 친하다고는 단정지을 수 없습니다。,小学校[しょうがっこう]から同[おな]じクラスだからといって親[した]しいとは限[かぎ]りません。
JLPT_N3_암기장::66p,[여러 품사 뒤에 접속하는 문형],～とは限らない,~라고 할 수는 없다,姉は３歳からピアノを習っていますが彼女の意思とは限らない。,누나는 3살 때부터 피아노를 배우고 있지만 그녀의 의사라고는 단정지을 수 없다。,姉[あね]は３歳[さんさい]からピアノ[ぴあの]を習[なら]っていますが彼女[かのじょ]の意思[いし]とは限[かぎ]らない。
JLPT_N3_암기장::66p,[여러 품사 뒤에 접속하는 문형],～うえに,~데다가,友達は宿題を早く終わらせたうえに、私の宿題も手伝ってくれた。,"친구는 숙제를 빨리 끝낸 데다가, 내 숙제도 도와주었다。",友達[ともだち]は宿題[しゅくだい]を早[はや]く終[お]わらせたうえに、私[わたし]の宿題[しゅくだい]も手伝[てつだ]ってくれた。
JLPT_N3_암기장::66p,[여러 품사 뒤에 접속하는 문형],～うえに,~데다가,あの魚は巨大なうえにめずらしいので高く売れた。,저 물고기는 거대한 데다가 희귀하기 때문에 비싸게 팔렸다。,あの魚[さかな]は巨大[きょだい]なうえにめずらしいので高[たか]く売[う]れた。
JLPT_N3_암기장::66p,[여러 품사 뒤에 접속하는 문형],～うえに,~데다가,この仕事は危ないうえに、給料も安いのでやりたくない。,"이 일은 위험한 데다가, 급료도 싸기 때문에 하고 싶지 않다。",この仕事[しごと]は危[あぶ]ないうえに、給料[きゅうりょう]も安[やす]いのでやりたくない。
JLPT_N3_암기장::66p,[여러 품사 뒤에 접속하는 문형],～うえに,~데다가,厳しい訓練であるうえに休憩時間も少なく、みんな疲れていた。,"엄한 훈련인 데다가 휴식 시간도 적어, 모두 지쳐 있었다。",厳[きび]しい訓練[くんれん]であるうえに休憩時間[きゅうけいじかん]も少[すく]なく、みんな疲[つか]れていた。
JLPT_N3_암기장::67p,[여러 품사 뒤에 접속하는 문형],～かわりに,~대신에,私が洗濯物をたたむかわりにあなたはお皿を洗ってね。,내가 빨래를 개는 대신에 너는 접시를 씻어줘。,私[わたし]が洗濯物[せんたくもの]をたたむかわりにあなた[あなた]はお皿[さら]を洗[あら]ってね。
JLPT_N3_암기장::67p,[여러 품사 뒤에 접속하는 문형],～かわりに,~대신에,人前で話すのが苦手なかわりに文章を書くことは得意です。,사람들 앞에서 이야기하는 것이 서투른 대신에 글을 쓰는 것은 잘합니다。,人前[ひとまえ]で話[はな]すのが苦手[にがて]なかわりに文章[ぶんしょう]を書くことは得意[とくい]です。
JLPT_N3_암기장::67p,[여러 품사 뒤에 접속하는 문형],～かわりに,~대신에,このお店はアクセスが悪いかわりに、味は最高なんですよ。,"이 가게는 접근성이 나쁜 대신에, 맛은 최고입니다。",このお店[おみせ]はアクセス[あくせす]が悪[わる]いかわりに、味[あじ]は最高[さいこう]なんですよ。
JLPT_N3_암기장::67p,[여러 품사 뒤에 접속하는 문형],～かわりに,~대신에,私のかわりに山本さんが発表する予定です。,나 대신에 야마모토 씨가 발표할 예정입니다。,私[わたし]のかわりに山本[やまもと]さんが発表[はっぴょう]する予定[よてい]です。
JLPT_N3_암기장::67p,[여러 품사 뒤에 접속하는 문형],～からといって,"~라고 해서, ~라고 하더라도",失敗したからといってあきらめる必要はない。,실패했다고 해서 포기할 필요는 없다。,失敗[しっぱい]したからといってあきらめる必要[ひつよう]はない。
JLPT_N3_암기장::67p,[여러 품사 뒤에 접속하는 문형],～からといって,"~라고 해서, ~라고 하더라도",面倒だからといって宿題をしないわけにはいかない。,귀찮다고 해서 숙제를 안 할 수는 없다。,面倒[めんどう]だからといって宿題[しゅくだい]をしないわけにはいかない。
JLPT_N3_암기장::67p,[여러 품사 뒤에 접속하는 문형],～からといって,"~라고 해서, ~라고 하더라도",安いからといって何でも買うのはよくない。,싸다고 해서 뭐든지 사는 것은 좋지 않다。,安[やす]いからといって何[なん]でも買[か]うのはよくない。
JLPT_N3_암기장::67p,[여러 품사 뒤에 접속하는 문형],～からといって,"~라고 해서, ~라고 하더라도",医者だからといってすべての病気は治せない。,의사라고 해서 모든 병을 고칠 수는 없다。,医者[いしゃ]だからといってすべての病気[びょうき]は治[なお]せない。
JLPT_N3_암기장::67p,[여러 품사 뒤에 접속하는 문형],～せいで,"~탓에, ~탓으로",寝坊したせいで、新幹線に乗れなかった。,늦잠을 잔 탓에 신칸센을 못 탔다。,寝坊[ねぼう]したせいで、新幹線[しんかんせん]に乗[の]れなかった。
JLPT_N3_암기장::67p,[여러 품사 뒤에 접속하는 문형],～せいで,"~탓에, ~탓으로",腹の中が空いていないせいで授業に全然集中できない。,배가 고프지 않은 탓에 수업에 전혀 집중할 수 없다。,腹[はら]の中[なか]が空[す]いていないせいで授業[じゅぎょう]に全然[ぜんぜん]集中[しゅうちゅう]できない。
JLPT_N3_암기장::67p,[여러 품사 뒤에 접속하는 문형],～せいで,"~탓에, ~탓으로",気候がおかしいせいで突然暑くなったり寒くなったりする。,기후가 이상한 탓에 갑자기 더워졌다가 추워졌다가 한다。,気候[きこう]がおかしいせいで突然[とつぜん]暑[あつ]くなったり寒[さむ]くなったりする。
JLPT_N3_암기장::67p,[여러 품사 뒤에 접속하는 문형],～せいで,"~탓에, ~탓으로",少ない予算のせいで買いたかったプレゼントが買えなかった。,적은 예산 탓에 사고 싶었던 선물을 못 샀다。,少[すく]ない予算[よさん]のせいで買[か]いたかったプレゼント[ぷれぜんと]が買[か]えなかった。
JLPT_N3_암기장::68p,[여러 품사 뒤에 접속하는 문형],～ことに,~마다,パンが焼けることに、すぐお店に出して売っています。,"빵이 구워질 때마다, 바로 가게에 내서 팔고 있습니다。",パン[ぱん]が焼[や]けることに、すぐお店[みせ]に出[だ]して売[う]っています。
JLPT_N3_암기장::68p,[여러 품사 뒤에 접속하는 문형],～ことに,~마다,あのめざまし時計は10分ごとに鳴るようにしておきました。,저 알람 시계는 10분마다 울리도록 해 두었습니다。,あのめざまし時計[どけい]は10分[じゅっぷん]ごとに鳴[な]るようにしておきました。
JLPT_N3_암기장::68p,[여러 품사 뒤에 접속하는 문형],～最中に,~한창 ~하는 중에,勉強をしている最中に停電した。,한창 공부를 하는 중에 정전됐다。,勉強[べんきょう]をしている最中[さいちゅう]に停電[ていでん]した。
JLPT_N3_암기장::68p,[여러 품사 뒤에 접속하는 문형],～最中に,~한창 ~하는 중에,商品の輸送の最中に問題が発生したと会社から連絡が来た。,상품의 운송 중에 문제가 발생했다고 회사에서 연락이 왔다。,商品[しょうひん]の輸送[ゆそう]の最中[さいちゅう]に問題[もんだい]が発生[はっせい]したと会社[かいしゃ]から連絡[れんらく]が来[き]た。
JLPT_N3_암기장::68p,[여러 품사 뒤에 접속하는 문형],～くせに,~주제에,彼は遅れてきたくせに、席が悪いと文句を言った。,"그는 늦게 온 주제에, 자리가 나쁘다고 불만을 말했다。",彼[かれ]は遅[おく]れてきたくせに、席[せき]が悪[わる]いと文句[もんく]を言[い]った。
JLPT_N3_암기장::68p,[여러 품사 뒤에 접속하는 문형],～くせに,~주제에,自分も嫌なくせに、他の人にその仕事をやらせた。,"자신도 싫어하는 주제에, 다른 사람에게 그 일을 시켰다。",自分[じぶん]も嫌[いや]なくせに、他[ほか]の人[ひと]にその仕事[しごと]をやらせた。
JLPT_N3_암기장::68p,[여러 품사 뒤에 접속하는 문형],～たびに,~(할) 때마다,親に会うたびに、「いつ結婚するの」と聞かれるのがいやだ。,"부모님을 만날 때마다, '언제 결혼하니?'라고 듣는 것이 싫다。",親[おや]に会[あ]うたびに、「いつ結婚[けっこん]するの」と聞[き]かれるのがいやだ。
JLPT_N3_암기장::68p,[여러 품사 뒤에 접속하는 문형],～たびに,~(할) 때마다,事件の解決のたびにニュースで大きく取り上げられる。,사건 해결 때마다 뉴스에서 크게 거론된다。,事件[じけん]の解決[かいけつ]のたびにニュース[にゅーす]で大[おお]きく取[と]り上[あ]げられる。
JLPT_N3_암기장::68p,[여러 품사 뒤에 접속하는 문형],～ために,~위해서,野菜をおいしく育てるためには水と太陽と土が必要です。,채소를 맛있게 키우기 위해서는 물과 태양과 흙이 필요합니다。,野菜[やさい]をおいしく育[そだ]てるためには水[みず]と太陽[たいよう]と土[つち]が必要[ひつよう]です。
JLPT_N3_암기장::68p,[여러 품사 뒤에 접속하는 문형],～ために,~위해서,世界平和のために国際会議が開かれる。,세계 평화를 위해서 국제회의가 열린다。,世界平和[せかいへいわ]のために国際会議[こくさいかいぎ]が開[ひら]かれる。
JLPT_N3_암기장::68p,[여러 품사 뒤에 접속하는 문형],～ために,~위해서,これ以上子供を減らさないために政府は対策をすべきです。,이 이상 아이를 줄지 않게 하기 위해서 정부는 대책을 세워야 합니다。,これ以上[いじょう]子供[こども]を減[へ]らさないために政府[せいふ]は対策[たいさく]をすべきです。
JLPT_N3_암기장::69p,[여러 품사 뒤에 접속하는 문형],～ついでに,~하는 김에,郵便局に行くついでに本屋によって雑誌を買って来てくれない？,우체국에 가는 김에 서점에 들러서 잡지를 사 와 주지 않을래?,郵便局[ゆうびんきょく]に行[い]くついでに本屋[ほんや]によって雑誌[ざっし]を買[か]って来[き]てくれない？
JLPT_N3_암기장::69p,[여러 품사 뒤에 접속하는 문형],～ついでに,~하는 김에,誕生日のお祝いのついでに就職のお祝いもしましょう。,생일 축하하는 김에 취직 축하도 합시다。,誕生日[たんじょうび]のお祝い[おいわい]のついでに就職[しゅうしょく]のお祝い[おいわい]もしましょう。
JLPT_N3_암기장::69p,[여러 품사 뒤에 접속하는 문형],～とおりに,~대로,私の言うとおりにしてください。,제 말하는 대로 해주세요。,私[わたし]の言[い]うとおりにしてください。
JLPT_N3_암기장::69p,[여러 품사 뒤에 접속하는 문형],～とおりに,~대로,覚えたとおりに一度やってみましょう。,외운 대로 한 번 해 봅시다。,覚[おぼ]えたとおりに一度[いちど]やってみましょう。
JLPT_N3_암기장::69p,[여러 품사 뒤에 접속하는 문형],～とおりに,~대로,説明書のとおりに組み立てたら簡単に完成しました。,설명서대로 조립했더니 간단히 완성했습니다。,説明書[せつめいしょ]のとおりに組[く]み立[た]てたら簡単[かんたん]に完成[かんせい]しました。
JLPT_N3_암기장::69p,[여러 품사 뒤에 접속하는 문형],～とおりに,~대로,普段どおりに早く寝ようとしたが、昨日はなかなか眠れなかった。,"평소대로 빨리 자려고 했지만, 어제는 좀처럼 잘 수 없었다。",普段[ふだん]どおりに早[はや]く寝[ね]ようとしたが、昨日[きのう]はなかなか眠[ねむ]れなかった。
JLPT_N3_암기장::69p,[여러 품사 뒤에 접속하는 문형],～とともに,"~와 함께, ~와 동시에",健康になるとともに体力もついた。,건강해짐과 함께 체력도 붙었다。,健康[けんこう]になるとともに体力[たいりょく]もついた。
JLPT_N3_암기장::69p,[여러 품사 뒤에 접속하는 문형],～とともに,"~와 함께, ~와 동시에",町の発展とともに引っ越してくる人が増えた。,마을의 발전과 함께 이사해 오는 사람이 늘었다。,町[まち]の発展[はってん]とともに引[ひ]っ越[こ]してくる人[ひと]が増[ふ]えた。
